{
  "$schema": "../../governance/claim.schema.json",
  "branch": "computation",
  "candidate_grammar": {
    "boundary": "All generated finite finite relational traversal and structure structures whose carriers, relations, traces and interfaces are composed from admitted Foundation, Mathematics and Information Science forms. Applies to finite generated graphs; physical networks require empirical translation.",
    "completeness_certificate": "sha256:f1630f72ede9480e5df1a74cc9afb4babf396c07f5dfea3373dba6cc38f1f609",
    "generator": "Generate the literal product of the eight registered Algorithms and Mathematical Data Structures structural axes for finite relational traversal and structure."
  },
  "claim_id": "SFT-COMP-ALG-TREES-GRAPHS-001",
  "dependencies": [
    "SFT-COMP-ALG-STRINGS-SEQUENCES-001",
    "SFT-FOUNDATION-FORM-ENFORCEMENT-001",
    "SFT-MATH-DISCRETE-001",
    "SFT-MATH-GRAPH-NETWORK-001",
    "SFT-MATH-LOGIC-PROOF-001",
    "SFT-MATH-CATEGORY-TYPE-COMPOSITION-001",
    "SFT-INFO-ENCODING-DECODING-001",
    "SFT-INFO-CONSERVATION-LOSS-001"
  ],
  "empirical_protocol": null,
  "excluded_inputs": [
    "no conventional machine, algorithm, language, security definition or learning model may select the law",
    "no numerical zero, negative, irrational, imaginary or floating proof quantity",
    "no completed infinity or ungenerated continuum",
    "no free, fitted or learned parameter",
    "no application result or pretrained model",
    "Applies to finite generated graphs; physical networks require empirical translation."
  ],
  "intended_certificate": "Independent regeneration of all 256 candidates, the sole survivor, closure and controls.",
  "provenance_classes": [
    "forward_forcing"
  ],
  "registered_by": "Maria Smith",
  "registration_date": "2026-07-23",
  "required_controls": [
    "false_premise",
    "tampered_source",
    "tampered_artifact",
    "boundary"
  ],
  "statement": "The forced finite relational traversal and structure kernel retains generated vertices and edges; root or start identity; frontier support; visited ledger; path or component witness; termination; every operation is source-bound, trace-complete, boundary-explicit, composition-preserving, successor-general and contains no imported answer-producing premise.",
  "status": "independently_replicated",
  "title": "Fold tree and graph algorithm law"
}
