{
  "$schema": "../../governance/claim.schema.json",
  "branch": "physics",
  "candidate_grammar": {
    "boundary": "All finite thermal forms generated from exact state counts, held distinctions, observation merging, recurrence and closed energy transfer without importing a statistical distribution or continuum equation.",
    "completeness_certificate": "sha256:735a8a30cdb32250aacfd907d6560811348d4cea885039bd46a5b8118278a4f4",
    "generator": "Generate the complete microstate support, observation partition, energy-transfer provenance, target-access, measurement-record, row, successor and extra-rule product."
  },
  "claim_id": "SFT-PHYS-THERMO-TEMPERATURE-001",
  "dependencies": [
    "SFT-INFO-ENTROPY-UNCERTAINTY-001",
    "SFT-INFO-CONSERVATION-LOSS-001",
    "SFT-MATH-DYNAMICAL-SYSTEMS-001",
    "SFT-PHYS-MECH-WORK-ENERGY-001",
    "SFT-PHYS-MEAS-UNCERTAINTY-001",
    "SFT-PHYS-WAVE-ENERGY-MOMENTUM-001",
    "SFT-PHYS-THERMO-MICRO-MACRO-001"
  ],
  "empirical_protocol": "experiments/physics/SFT-EXP-PHYS-THERMO-TEMPERATURE-001/registration.json",
  "excluded_inputs": [
    "ungenerated continuum, completed infinity or equilibrium ensemble",
    "floating, irrational or signed proof magnitude",
    "imported thermodynamic equation, fitted coefficient or target-selected value",
    "target access, omitted adverse row or unrecorded microscopic predecessor"
  ],
  "intended_certificate": "Complete 256-form census, sole survivor, independent regeneration and blind post-seal external comparison.",
  "provenance_classes": [
    "forward_forcing"
  ],
  "registered_by": "Maria Smith",
  "registration_date": "2026-07-23",
  "required_controls": [
    "false_premise",
    "tampered_source",
    "tampered_artifact",
    "boundary"
  ],
  "statement": "Temperature is forced as the exact ordering carrier comparing energy-support change with accessible-state multiplicity change relative to one held thermal reference.",
  "status": "empirically_tested",
  "title": "Temperature carrier and thermal ordering"
}
