{
  "$schema": "../../governance/claim.schema.json",
  "branch": "physics",
  "candidate_grammar": {
    "boundary": "All finite exact Fold carriers named by this claim and every product of the eight registered binary form axes; conventional correspondence and physical calibration remain downstream.",
    "completeness_certificate": "sha256:532f5b1f68508e357ba9191cb4b01e5708f16825d898e6849e5f05a89dd92f03",
    "generator": "Generate the complete eight-axis product for lorentz transfer partition, including carrier, dependency, relation, enumeration, minimality, measurement direction, record and extension."
  },
  "claim_id": "SFT-PHYS-FIELD-LORENTZ-TRANSFER-003",
  "dependencies": [
    "SFT-PHYS-FIELD-MAGNETIC-RELATIVITY-003",
    "SFT-PHYS-MECH-FORCE-001",
    "SFT-PHYS-MECH-CONSERVATION-001"
  ],
  "empirical_protocol": null,
  "excluded_inputs": [
    "no V1/V2 executable, candidate table, certificate or answer artifact as a premise",
    "no conventional field equation, continuum, matrix algebra or measured constant selecting a survivor",
    "no fitted coefficient, adjustable phase, imported normalization or target-selected value",
    "no semantic numerical zero, negative, irrational, imaginary or floating proof quantity",
    "no target access before the complete exact result and candidate census are sealed"
  ],
  "intended_certificate": "Independent regeneration of 256 forms, unique survivor, exact arithmetic, hostile controls and depth-independent finite-support closure.",
  "provenance_classes": [
    "forward_forcing"
  ],
  "registered_by": "Maria Smith",
  "registration_date": "2026-07-24",
  "required_controls": [
    "false_premise",
    "tampered_source",
    "tampered_artifact",
    "boundary"
  ],
  "statement": "Motion does not create a second unaccounted force: it holds the exact speed-square share of electric transfer while the positive remainder acts on the observed carrier, and both shares reconstruct the source force.",
  "status": "independently_replicated",
  "title": "Lorentz transfer partition"
}
