{
  "$schema": "../../governance/claim.schema.json",
  "branch": "computation",
  "candidate_grammar": {
    "boundary": "All generated finite action-sequence construction toward exact goals structures whose carriers, relations, traces and interfaces are composed from admitted Foundation, Mathematics and Information Science forms. Only the generated environment model is covered.",
    "completeness_certificate": "sha256:94004478e61e1ab8efbf1281203fc61c897cf44e38c8db4ad02b52365c7019ad",
    "generator": "Generate the literal product of the eight registered Learning and Intelligence Theory structural axes for action-sequence construction toward exact goals."
  },
  "claim_id": "SFT-COMP-LEARN-SEARCH-PLANNING-001",
  "dependencies": [
    "SFT-COMP-LEARN-INDUCTION-001",
    "SFT-FOUNDATION-FORM-ENFORCEMENT-001",
    "SFT-MATH-DISCRETE-001",
    "SFT-MATH-GRAPH-NETWORK-001",
    "SFT-MATH-LOGIC-PROOF-001",
    "SFT-MATH-CATEGORY-TYPE-COMPOSITION-001",
    "SFT-INFO-ENCODING-DECODING-001",
    "SFT-INFO-CONSERVATION-LOSS-001"
  ],
  "empirical_protocol": null,
  "excluded_inputs": [
    "no conventional machine, algorithm, language, security definition or learning model may select the law",
    "no numerical zero, negative, irrational, imaginary or floating proof quantity",
    "no completed infinity or ungenerated continuum",
    "no free, fitted or learned parameter",
    "no application result or pretrained model",
    "Only the generated environment model is covered."
  ],
  "intended_certificate": "Independent regeneration of all 256 candidates, the sole survivor, closure and controls.",
  "provenance_classes": [
    "forward_forcing"
  ],
  "registered_by": "Maria Smith",
  "registration_date": "2026-07-23",
  "required_controls": [
    "false_premise",
    "tampered_source",
    "tampered_artifact",
    "boundary"
  ],
  "statement": "The forced action-sequence construction toward exact goals kernel retains state carrier; action transitions; initial state; goal class; path support; plan selection; failure and resource ledgers; every operation is source-bound, trace-complete, boundary-explicit, composition-preserving, successor-general and contains no imported answer-producing premise.",
  "status": "independently_replicated",
  "title": "Fold search and planning law"
}
