{
  "$schema": "../../governance/claim.schema.json",
  "branch": "computation",
  "candidate_grammar": {
    "boundary": "All generated finite relative reduction classes structures whose carriers, relations, traces and interfaces are composed from admitted Foundation, Mathematics and Information Science forms. Degrees are finite generated relation classes; no completed transfinite hierarchy is claimed.",
    "completeness_certificate": "sha256:7fdd77daa0ed7de987d15f92325c15b5a0f9034535436080d3ade6b19fc489bd",
    "generator": "Generate the literal product of the eight registered Computability structural axes for relative reduction classes."
  },
  "claim_id": "SFT-COMP-CBL-DEGREES-001",
  "dependencies": [
    "SFT-COMP-CBL-REDUCTION-001",
    "SFT-FOUNDATION-FORM-ENFORCEMENT-001",
    "SFT-MATH-DISCRETE-001",
    "SFT-MATH-GRAPH-NETWORK-001",
    "SFT-MATH-LOGIC-PROOF-001",
    "SFT-MATH-CATEGORY-TYPE-COMPOSITION-001",
    "SFT-INFO-ENCODING-DECODING-001",
    "SFT-INFO-CONSERVATION-LOSS-001"
  ],
  "empirical_protocol": null,
  "excluded_inputs": [
    "no conventional machine, algorithm, language, security definition or learning model may select the law",
    "no numerical zero, negative, irrational, imaginary or floating proof quantity",
    "no completed infinity or ungenerated continuum",
    "no free, fitted or learned parameter",
    "no application result or pretrained model",
    "Degrees are finite generated relation classes; no completed transfinite hierarchy is claimed."
  ],
  "intended_certificate": "Independent regeneration of all 256 candidates, the sole survivor, closure and controls.",
  "provenance_classes": [
    "forward_forcing"
  ],
  "registered_by": "Maria Smith",
  "registration_date": "2026-07-23",
  "required_controls": [
    "false_premise",
    "tampered_source",
    "tampered_artifact",
    "boundary"
  ],
  "statement": "The forced relative reduction classes kernel retains registered problems; mutual reduction relation; equivalence classes; strict one-way reachability; transitive closure; incomparability witness; every operation is source-bound, trace-complete, boundary-explicit, composition-preserving, successor-general and contains no imported answer-producing premise.",
  "status": "independently_replicated",
  "title": "Fold degrees-of-computability law"
}
