{
  "$schema": "../../governance/claim.schema.json",
  "branch": "physics",
  "candidate_grammar": {
    "boundary": "All exact positive interval predictions formed from registered measured inputs, one already forced relation, capability-closed arithmetic and a post-seal external target.",
    "completeness_certificate": "sha256:6b6c7b37795cf011c5d81041e5b347a0fc90cab6620b486d68ca3c4cc6a9b125",
    "generator": "Generate the complete exact-relation, input-provenance, target-access, interval, comparison, row, successor and extra-rule product."
  },
  "claim_id": "SFT-PHYS-VALIDATION-FIELD-ELECTRIC-POTENTIAL-001",
  "dependencies": [
    "SFT-PHYS-MEAS-CAPABILITY-PREDICTION-001",
    "SFT-PHYS-MEAS-TARGET-CUSTODY-001",
    "SFT-PHYS-MEAS-HOSTILE-PACKAGE-001",
    "SFT-PHYS-MEAS-VALUE-RECORD-001",
    "SFT-PHYS-MEAS-UNCERTAINTY-001",
    "SFT-PHYS-FIELD-ELECTRIC-POTENTIAL-001"
  ],
  "empirical_protocol": "experiments/physics/SFT-EXP-PHYS-VALIDATION-FIELD-ELECTRIC-POTENTIAL-001/registration.json",
  "excluded_inputs": [
    "floating, irrational, imaginary, signed or numerical-null proof values",
    "fitted coefficients, target-selected relations or unregistered constants",
    "target access before prediction seal",
    "omitted input uncertainty, external row or adverse control"
  ],
  "intended_certificate": "Complete 256-form census, sole survivor, independent regeneration and blind post-seal external comparison.",
  "provenance_classes": [
    "forward_forcing"
  ],
  "registered_by": "Maria Smith",
  "registration_date": "2026-07-23",
  "required_controls": [
    "false_premise",
    "tampered_source",
    "tampered_artifact",
    "boundary"
  ],
  "statement": "The atomic electric-potential carrier is predicted by exact energy transfer per elementary held-charge carrier.",
  "status": "empirically_tested",
  "title": "Exact electric-potential measured-value correspondence"
}
